title;start;cm_process_based_steel;CES_parameters;c_keep_iteration_gdxes;cm_nash_mode;optimization;slurmConfig;regionmapping;extramappings_historic;c_changeProdCost;cm_rcp_scen;cm_iterative_target_adj;subsidizeLearning;c_budgetCO2from2020;carbonprice;cm_co2_tax_2020;cm_peakBudgYr;cm_CO2priceRegConvEndYr;cm_emiscen;c_regi_earlyreti_rate;c_tech_earlyreti_rate;cm_fetaxscen;cm_co2_tax_growth;cm_bioenergy_SustTax;cm_maxProdBiolc;c_ccsinjecratescen;c_ccscapratescen;cm_CESMkup_build;cm_CESMkup_ind;techpol;regipol;cm_implicitQttyTarget;cm_loadFromGDX_implicitQttyTargetTax;cm_emiMktTarget;cm_NucRegiPol;cm_CoalRegiPol;cm_altFeEmiFac;cm_POPscen;cm_GDPscen;cm_demScen;cm_oil_scen;cm_gas_scen;cm_coal_scen;c_techAssumptScen;cm_nucscen;cm_so2tax_scen;cm_multigasscen;cm_LU_emi_scen;cm_tradecostBio;cm_1stgen_phaseout;c_SSP_forcing_adjust;cm_APscen;water;cm_EDGEtr_scen;cm_startyear;path_gdx;path_gdx_ref;path_gdx_bau;path_gdx_refpolicycost;description
CutCES-Ref;1;off;;;;;5;;;;;;;0;;;2100;;;;off;;;;;;;;;;;;;;;;EUR_regi, NEU_regi;;;;;;;;;;;;;;;;heat;Mix1;2005;;;;;SSP2EU-Base: This baseline calibration scenario follows the Shared Socioeconomic Pathways 2 called Middle of the Road.
CutCES-Base;1;on;;;;;5;;;;;;;0;;;2100;;;;off;;;;;;;;;;;;;;;;EUR_regi, NEU_regi;;;;;;;;;;;;;;;;heat;Mix1;2005;;;;;SSP2EU-Base: This baseline calibration scenario follows the Shared Socioeconomic Pathways 2 called Middle of the Road.
CutCES-NDC;0;on;;;;;5;;;;rcp45;3;globallyOptimal;0;NDC;1;2100;;9;;;;;;;;;;;NDC;regiCarbonPrice;2030.EUR_regi.tax.t.FE_wo_b_wo_n_e.all 1.2809;;2020.2030.EUR_regi.all.year.netGHG_LULUCFGrassi 2.450;on;on;EUR_regi, NEU_regi;;;;;;;;;;3;;;;;;heat;Mix2;2015;;CutCES-Base;CutCES-Base;;SSP2EU-NDC: This Nationally Determined Contribution (NDC) scenario follows the Shared Socioeconomic Pathways 2 called Middle of the Road. The NDC includes all pledged policies even if not yet implemented. It assumes that the moderate and heterogeneous climate ambition reflected in the NDCs at the begining of 2021 continues over the 21st century. This scenario serves as reference for all other policy scenarios and The NPi scenario until 2020.
CutCES-NPi;0;on;;;;;5;;;0,1;rcp45;3;;0;NPi2018;1;2100;;9;;;;;;;;;;;NPi2018;regiCarbonPrice;2030.EUR_regi.tax.t.FE_wo_b_wo_n_e.all 1.2809;on;;on;on;EUR_regi, NEU_regi;;;;;;;;;;3;;;;;;heat;Mix1;2025;;CutCES-NDC;CutCES-Base;;SSP2EU-NPi: This National Policies Implemented (Npi) scenario follows the Shared Socioeconomic Pathways 2 called Middle of the Road. The NPi is identical to the NDC scenario until 2020 but assumes that policies fail to achieve NDC targets in 2030. Instead, carbon prices are assumed to grow and converge more slowly, leading to emissions trajectories in line with bottom-up studies on the effect of currently implemented policies.
CutCES-PkBudg500;0;on;;;;;5;;;;rcp20;9;globallyOptimal;500;diffCurvPhaseIn2Lin;100;2080;;9;;;;;;;;;;;NDC;regiCarbonPrice;2030.EUR_regi.tax.t.FE_wo_b_wo_n_e.all 1.2809;on;;on;on;EUR_regi, NEU_regi;;;;;;;;;;;;;;;;heat;Mix4;2025;;CutCES-NDC;CutCES-Base;;SSP2EU-PkBudg500: This climate policy scenario follows the Shared Socioeconomic Pathways 2 called Middle of the Road. The stylized climate policy scenario assumes a peak budget of 500 Gt?CO2 on total CO2 emissions from 2015 to 2100. This is a 1.5??C scenario, peak warming is allowed to be at or slightly above 1.5??C, at median climate sensitivity but returns to values below 1.5??C in at least 67?% of scenarios by the end of the century.
